Type,Policy Document ID,Title,Translated title,Source title,Source country,Source type,Source sub-type,Published on,Cited research titles,Cited research DOIs,Topics,Document URL,Text
Policy citation,wto-0f6e2f0b31471176fd947d5ee18e6c90,World Trade Report 2023 — Re-globalization for a secure， inclusive and sustainable future,,World Trade Organization,IGO,igo,,9/1/23,Quantifying the cost savings of global solar photovoltaic supply chains,10.1038/s41586-022-05316-6,OECD  ，World Trade Organization  ，International Trade Centre  ，International Energy Agency  ，United Nations Environment Programme  ，International Monetary Fund  ，United Nations Conference on Trade and Development  ，Economics  ，International Labour Organization  ，Globalization  ，Sustainability  ，Trade  ，China–United States trade war  ，International economics  ，Protectionism  ，International trade  ，Economy  ，International relations  ，Free trade  ，Small and medium-sized enterprises  ，Sustainable development  ，Global value chain  ，European Union  ，World economy  ，Subsidy  ，Global politics  ，Sustainable Development Goals  ，G20  ，Export  ，Innovation  ，Tariff  ，European Commission  ，Politics  ，Market (economics)  ，Climate change  ，Labour economics  ，Economies  ，Economic inequality  ，Peterson Institute for International Economics  ，Shangri-La Dialogue  ，Climate change mitigation  ，Policy  ，World Bank  ，Asian Development Bank  ，Business  ，China  ，Cost of living  ，Poverty  ，Greenhouse gas emissions  ，Economic growth  ，Gross domestic product  ，Poverty reduction  ，Market access  ，Least developed countries  ，Developing country  ，Agreement on the Application of Sanitary and Phytosanitary Measures  ，Convergence (economics)  ，Supply chain  ，Competition (economics)  ，Productivity  ，Trade agreement  ，Non-tariff barriers to trade  ，Renewable energy  ，Commercial policy  ，Environmental governance  ，Multilateralism  ，African Continental Free Trade Area  ，Economic integration  ，Agriculture  ，Risk  ，Sustainable energy  ，Extreme poverty  ，Environmental policy  ，Technology  ，Low-carbon economy  ，COVID-19 pandemic  ，Input–output model  ，Transatlantic Trade and Investment Partnership  ，2007–2008 financial crisis  ，Redistribution of income and wealth  ，Value chain  ，Commerce  ，Value added  ，Economic globalization  ，E-commerce  ，Habitat fragmentation  ，Economic development  ，Friendshoring  ，Information and communications technology  ，Net zero emissions  ，Security  ，International business  ，Green growth  ，Intellectual property  ，Outsourcing  ，United States  ，Carbon Border Adjustment Mechanism  ，Photovoltaics  ，World Economic Forum  ，Manufacturing,https://www.wto.org/english/res_e/publications_e/wtr23_e.htm,
Policy citation,ecologic-c3be4fc6b91aae29e68266bf8d713eaa,Comparing Policy Options to Address Export-related Carbon Leakage,,Ecologic Institute,Germany,think tank,,6/20/23,Quantifying the cost savings of global solar photovoltaic supply chains,10.1038/s41586-022-05316-6,Climate change mitigation  ，European Union Emissions Trading System  ，Carbon price  ，European Green Deal  ，Carbon neutrality  ，European Union  ，Subsidy  ，Low-carbon economy  ，Greenhouse gas emissions  ，Innovation  ，Export  ，Politics of climate change  ，Emissions trading  ，World Trade Organization  ，Competition (economics)  ，Policy  ，Steelmaking  ，Climate finance  ，Renewable energy  ，Research and development  ，Emission intensity  ，Carbon dioxide removal  ，Tax  ，Option (finance)  ，Finance  ，Market (economics)  ，Risk  ，Price  ，Economy  ，Investment  ，Carbon leakage  ，Economies of scale  ，International trade  ，Intergovernmental Panel on Climate Change  ，Steel  ，Incentive  ，European Commission  ，Energy transition  ，Infrastructure  ，Dumping (pricing policy)  ，Rebate (marketing)  ，Carbon Border Adjustment Mechanism  ，Trade  ，Clean technology  ，Cost  ，Sustainable finance  ，Industrial policy  ，Council of the European Union  ，Business  ，Auction,https://www.ecologic.eu/19263,
Policy citation,banquedefrance-a94f8ded7df925994d2942c30978e0e5,La Chine peut-elle transformer le défi de la transition climatique en opportunité ?,Can China transform the challenge of climate transition into an opportunity?,Banque de France,France,government,,6/15/23,Challenges and opportunities for carbon neutrality in China,10.1038/s43017-021-00244-x,China  ，Coal  ，Renewable energy  ，Low-carbon economy  ，Energy transition  ，World energy supply and consumption  ，Net zero emissions  ，United States  ，Energy mix  ，Economic growth  ，Carbon dioxide  ，Economy  ，Energy  ，Economy of China  ，Fossil fuel  ，Green bond  ，Nature  ，Gross domestic product  ，World Bank  ，Efficient energy use  ，European Union  ，Bank  ，Wind power  ，France  ，Sustainable development,https://www.banque-france.fr/fr/publications-et-statistiques/publications/a-chine-peut-elle-transformer-le-defi-de-la-transition-climatique-en-opportunite,
Policy citation,worldbank-a1a0891dd87aef08a57647384ca98283,Electric Mobility and Power Systems: Impacts and Mitigation Strategies in Developing Countries,,World Bank,IGO,igo,,4/24/23,Modeling the impact of EVs in the Chinese power system: Pathways for implementing emissions reduction commitments in the power and transportation sectors,10.1016/j.enpol.2020.111962,Electric vehicle  ，Electrical grid  ，Plug-in hybrid  ，Smart charging  ，Battery electric vehicle  ，Vehicle-to-grid  ，Variable renewable energy  ，Electric power distribution  ，Electric power transmission  ，Smart grid  ，Climate change mitigation  ，Renewable energy  ，Charging station  ，Demand response  ，Battery charger  ，Solar power  ，Electricity generation  ，Electric power quality  ，Infrastructure  ，International Energy Agency  ，Public utility  ，Photovoltaics  ，World energy supply and consumption  ，Hybrid electric vehicle  ，Peaking power plant  ，Electric battery  ，Developing country  ，Ancillary services (electric power)  ，Efficient energy use  ，Grid energy storage  ，Transport  ，Economic growth  ，Kilowatt-hour  ，Power electronics  ，Energy  ，Electric power  ，Electrical engineering  ，Nature  ，Electricity  ，Economy  ，Physical quantities  ，Power (physics)  ，Technology  ，Distributed generation  ，Fuel cell vehicle  ，Power outage  ，Electricity pricing  ，Sustainability  ，Fossil fuel power station  ，Transformer  ，Consumption (economics)  ，Electric vehicle battery  ，Direct current  ，Low-carbon economy  ，Policy  ，Photovoltaic system  ，Greenhouse gas  ，Electric energy consumption  ，Electricity market  ，Vehicle  ，Engine  ，Reliability engineering  ，Energy development  ，Sustainable technologies  ，Microgrid  ，Demand  ，Power inverter  ，Emission intensity  ，Greenhouse gas emissions  ，Electrical substation  ，Alternating current  ，Hydroelectricity  ，Electromagnetism  ，Load profile  ，Coal  ，Fuel,https://openknowledge.worldbank.org/handle/10986/39853,
Policy citation,grantham-6997f76275b0001700dca4f58affd5c9,Embracing the new paradigm of green development - Grantham Research Institute on climate change and the environment,,Grantham Institute,UK,think tank,,2/16/23,Challenges and opportunities for carbon neutrality in China,10.1038/s43017-021-00244-x,Solar power  ，Carbon neutrality  ，Sustainability  ，Low-carbon economy  ，Renewable energy  ，Economic growth  ，Transport  ，Electric vehicle  ，Agriculture  ，Climate change mitigation  ，Carbon accounting  ，Greenhouse gas emissions  ，Sustainable finance  ，Energy development  ，Infrastructure  ，Finance  ，China  ，Urbanization  ，Carbon emission trading  ，Market (economics)  ，Electricity generation  ，Efficient energy use  ，Innovation  ，Sustainable development  ，Energy transition  ，Consumerism  ，Gross domestic product  ，Policy  ，Economics  ，Sustainable transport  ，Carbon price  ，Manufacturing  ，Macroeconomics  ，Production (economics)  ，Carbon capture and storage  ，Emissions trading  ，Ecology  ，Strategy  ，Industrial Revolution  ，Fossil fuel  ，Variable renewable energy  ，Coal  ，Governance  ，Economy  ，Biodiversity  ，Belt and Road Initiative  ，World energy supply and consumption  ，Sustainable consumption  ，Modernization theory  ，Sustainable Development Goals  ，Climate governance  ，Meat  ，Fuel  ，Capital (economics)  ，Joseph Stiglitz  ，Natural capital  ，Wind power  ，Environmental degradation  ，Natural environment  ，Air pollution  ，Resource  ，Emission intensity  ，Car  ，Environmental impact of meat production  ，Developing country  ，Public transport  ，Externality  ，Plug-in electric vehicle  ，Productivity  ，Energy storage  ，Direct air capture  ，Green bond  ，Nature  ，Ecosystem service  ，Food security  ，Electrical grid  ，Subsidy  ，Institution  ，Environmental social science  ，Rail transport  ，Pollution  ，Economy of China  ，Pricing  ，System  ，Central bank  ，Factors of production  ，Risk  ，Tax  ，Carbon offset  ，Sustainable energy  ，Economic system  ，Health  ，Greenhouse gas inventory  ，Fertilizer  ，Smart city  ，Energy  ，Technology  ，Economy and the environment  ，Battery electric vehicle  ，Financial capital,https://www.lse.ac.uk/granthaminstitute/publication/embracing-the-new-paradigm-of-green-development/,
Policy citation,worldbank-0d63149243f92a572b77fbcc9e9c5138,Promoting Innovation to Decarbonize Industry in China,,World Bank,IGO,igo,,1/17/23,Challenges and opportunities for carbon neutrality in China,10.1038/s43017-021-00244-x,Supply chain  ，Productivity  ，Government procurement  ，World Bank  ，Energy  ，Life-cycle assessment  ，Low-carbon economy  ，Greenhouse gas emissions  ，Efficient energy use  ，Economic growth  ，Innovation  ，Carbon capture and storage  ，Emissions trading  ，Renewable energy  ，Carbon price  ，Subsidy  ，Green hydrogen  ，Infrastructure  ，International Energy Agency  ，Sustainable energy  ，European Union Emissions Trading System  ，Carbon neutrality  ，Tax  ，China  ，Fossil fuel  ，Environmental  ， social  ， and corporate governance  ，Research and development  ，Sustainable finance  ，Venture capital  ，Cement  ，Climate change mitigation  ，Energy conservation  ，Steel  ，Clean technology  ，European Union  ，Policy  ，Technology  ，Economy  ，Manufacturing  ，Heavy industry  ，Natural gas  ，Coal  ，Electrolysis  ，Finance  ，Funding  ，Greenhouse gas  ，Hydrogen  ，Green bond  ，Fuel  ，Steelmaking  ，Startup company  ，Hydrogen production  ，Biomass  ，Market (economics)  ，Intellectual property  ，Gross domestic product,https://openknowledge.worldbank.org/handle/10986/38488,
Policy citation,vtise-27da52f1bd55e3c1f6c6f2a0060ab0c1,Regeringsuppdrag om elektrifieringen av transporter : rekommendationer för att underlätta datadelning och nyttiggörande av data för planering， utveckling och drift av laddinfrastruktur och affärsmodeller,Government mandate on the electrification of transport: recommendations to facilitate data sharing and utilization of data for planning， development and operation of charging infrastructure and business models,VTI,Sweden,government,,1/9/23,Modeling the impact of EVs in the Chinese power system: Pathways for implementing emissions reduction commitments in the power and transportation sectors,10.1016/j.enpol.2020.111962,Electric car  ，European Union  ，Electricity market  ，Technology  ，Electric battery  ，Truck  ，Climate change  ，Economy  ，Competence (human resources)  ，Value chain,https://vti.diva-portal.org/smash/record.jsf?pid=diva2%3A1725636,
Name mention,unitednations-e91853bc3c2e9923c0cd7ea87ccc037d,Production Gap Report 2023 : Phasing down or phasing up? Top fossil fuel producers plan even more extraction despite climate promises,,United Nations,IGO,igo,,1/1/23,,,Climate change mitigation  ，Carbon capture and storage  ，Climate change  ，Greenhouse gas emissions  ，Fossil fuel  ，IPCC Sixth Assessment Report  ，Carbon neutrality  ，Energy transition  ，International Energy Agency  ，Bioenergy with carbon capture and storage  ，Coal  ，Renewable energy  ，Greenhouse gas  ，Paris Agreement  ，Fuel  ，2021 United Nations Climate Change Conference  ，Carbon budget  ，Carbon dioxide removal  ，Carbon sequestration  ，Petroleum  ，Carbon capture and utilization  ，Nationally determined contribution  ，United Nations Framework Convention on Climate Change  ，Nuclear power phase-out  ，Fossil fuel phase-out  ，Direct air capture  ，Liquefied natural gas  ，Natural gas  ，Energy  ，Natural environment  ，Nature  ，Politics of climate change  ，Low-carbon economy  ，Climate variability and change  ，Intergovernmental Panel on Climate Change  ，Environmental issues with fossil fuels  ，Environmental impact  ，Climate forcing  ，Methane  ，Natural resources  ，World energy supply and consumption  ，Global environmental issues  ，Chemistry  ，Societal collapse  ，Methane emissions  ，Economy  ，Fossil fuels  ，Greenhouse effect  ，Infrastructure  ，Global warming potential  ，Earth sciences  ，United Nations Climate Change conference  ，Carbon dioxide  ，Air pollution  ，Bioenergy  ，Energy crisis  ，Stranded asset  ，Environmental social science  ，Change,https://digitallibrary.un.org/record/4026849?ln=en,Cunha UFRJ， Rebecca Draeger UFRJ， Dimas Fauzi SEI， Emily Ghosh SEI， Kamila Godzinska E3G， Gang He City University of New York， Frank Jotzo The Australian National University， Bård Lahn University of Oslo， Michael Lazarus SEI， Yury Melnikov independent sustainable energy consultant; UNECE Task Force on Hydrogen， Tatiana Mitrova Columbia University， Yacob Mulugetta UCL， Anisha Nazareth SEI， James Ogunleye Carbon Limits Nigeria， Serik Orazgaliyev Nazarbayev University， Julia Paletta
Policy citation,unitednations-cd493e9a37dde7e15d97b653eb2588f2,World trade report 2023 :re-globalization for a secure， inclusive and sustainable future,,United Nations,IGO,igo,,1/1/23,Quantifying the cost savings of global solar photovoltaic supply chains,10.1038/s41586-022-05316-6,Cost of living  ，World Trade Organization  ，Globalization  ，Economic inequality  ，Sustainability  ，Greenhouse gas emissions  ，Poverty  ，Export  ，Gross domestic product  ，Economic growth  ，Global value chain  ，Poverty reduction  ，Market access  ，Climate change mitigation  ，Trade  ，Least developed countries  ，Developing country  ，Agreement on the Application of Sanitary and Phytosanitary Measures  ，Subsidy  ，Economy  ，Convergence (economics)  ，Supply chain  ，Productivity  ，Tariff  ，International trade  ，Multilateralism  ，Commercial policy  ，Policy  ，World economy  ，International relations  ，Environmental policy  ，Environmental governance  ，Free trade  ，Renewable energy  ，Global politics  ，Trade agreement  ，Market (economics)  ，Agriculture  ，Risk  ，Net zero emissions  ，Economic integration  ，Competition (economics)  ，Clean technology  ，Extreme poverty  ，China  ，Sustainable energy  ，Technology  ，Economies  ，Income  ，International business  ，Economics  ，COVID-19 pandemic  ，African Continental Free Trade Area  ，Sustainable development  ，Small and medium-sized enterprises  ，Low-carbon economy  ，Commerce  ，Non-tariff barriers to trade  ，Transatlantic Trade and Investment Partnership  ，Economic globalization  ，EU Carbon Border Adjustment Mechanism  ，Input–output model  ，2007–2008 financial crisis  ，Redistribution of income and wealth  ，E-commerce  ，Friendshoring  ，Value added  ，Business  ，Innovation  ，Protectionism  ，Information and communications technology  ，Politics  ，Economic development  ，Foreign direct investment  ，Green growth  ，European Union  ，Security  ，Photovoltaics  ，United States  ，Trade facilitation  ，Value chain,https://digitallibrary.un.org/record/4038425?ln=en,
Policy citation,keeikr-45348bdf9313e90611e3075e543ad428,국제 신재생에너지 정책변화 및 시장분석: 공급망 분석 및 산업활성화 정책을 중심으로,International Renewable Energy Policy Changes and Market Analysis: Focusing on Supply Chain Analysis and Industrial Activation Policies,Korea Energy Economics Institute,South Korea,think tank,,1/1/23,Quantifying the cost savings of global solar photovoltaic supply chains,10.1038/s41586-022-05316-6,Sustainable energy  ，Net-zero emissions  ，Renewable energy  ，Market power  ，Manufacturing  ，Economy  ，Energy  ，Industry (economics)  ，Electric generator  ，Export  ，Economics  ，Photovoltaics  ，Electric car,https://www.nkis.re.kr/subject_view1.do?otcCd=RG&otcNm=일반연구보고서&otpId=OTP_0000000000013562&otpSeq=0&eoSeq=383869&currentPage=1&searchSelect=&searchWord=&returnPage=newest_list.do&schLclaScsId=&pblYy=&agcNms=에너지경제연구원&listPerPage=50,
Policy citation,keeikr-9eee83ffecdb6e305aaaf042550dcbac,국제 신재생에너지 정책변화 및 시장분석: 공급망 분석 및 산업활성화 정책을 중심으로,International Renewable Energy Policy Changes and Market Analysis: Focusing on Supply Chain Analysis and Industrial Revitalization Policies,Korea Energy Economics Institute,South Korea,think tank,,1/1/23,Quantifying the cost savings of global solar photovoltaic supply chains,10.1038/s41586-022-05316-6,Sustainable energy  ，Net-zero emissions  ，Renewable energy  ，Market power  ，Manufacturing  ，Economy  ，Energy  ，Industry (economics)  ，Electric generator  ，Export  ，Economics  ，Photovoltaics  ，Electric car,https://www.nkis.re.kr/subject_view1.do?otpId=OTP_0000000000013562,
Name mention,nygov-649e5cffc4b7f6f9cb4386928908e674,Integration Analysis Technical Supplement,,New York State,USA,government,,12/15/22,,,Climate change mitigation  ，Greenhouse gas emissions  ，Low-carbon economy  ，Renewable energy  ，Biofuel  ，Energy storage  ，Grid energy storage  ，Co-benefits of climate change mitigation  ，Efficient energy use  ，Low-carbon fuel standard  ，Electric vehicle  ，Ground source heat pump  ，Climate change  ，Fuel  ，Greenhouse gas  ，Biomass  ，Wind power  ，Climate change scenario  ，Air source heat pump  ，World energy supply and consumption  ，Inflation Reduction Act of 2022  ，Heating  ， ventilation  ， and air conditioning  ，United States wind energy policy  ，Carbon neutrality  ，Carbon sequestration  ，Infrastructure  ，Green hydrogen  ，Zero-emissions vehicle  ，Coefficient of performance  ，Biodiesel  ，Carbon capture and storage  ，Heat pump  ，Carbon sink  ，Electric battery  ，Combined cycle power plant  ，Sensitivity analysis  ，Energy  ，Nature  ，Economy  ，Technology  ，Sustainable technologies  ，Electricity generation  ，Cost–benefit analysis  ，Physical sciences  ，Natural gas  ，Sustainable energy  ，Renewable natural gas  ，Carbon dioxide removal  ，Fuel cell  ，Electric heating  ，Refrigerant  ，Physical quantities  ，Hydrogen production  ，Transport  ，Environmental technology  ，Net present value  ，Hydrogen  ，Natural environment  ，New York State Energy Research and Development Authority  ，Sustainable development  ，Fossil fuel  ，Tax  ，Aviation biofuel  ，Electrical grid  ，Electrification  ，Inflation  ，Direct air capture  ，Waste  ，Electric power transmission  ，Energy technology  ，Tax credit  ，Air pollution,https://climate.ny.gov/-/media/Project/Climate/Files/Appendix-G.pdf,Technical Advisory Group Members      Vatsal Bhatt， Department of Materials Science and Chemical Engineering， Stony Brook University， and U.S Green Building Council;      Gang He， Department of Technology and Society， Stony Brook University;  Benjamin Houlton， College of Agriculture and Life Sciences， Cornell University;  Mark Jacobson， Department of Civil and Environmental Engineering， Stanford University;      Jesse Jenkins， Department of Mechanical and Aerospace Engineering and the Andlinger Center for Energy
Policy citation,ccpaca-b7add44e805bd9aa5908572e437ff608,Bet Big: A citizen’s guide to green industrial policy in Canada,,Canadian Centre for Policy Alternatives (CCPA),Canada,think tank,,10/25/22,Enabling a Rapid and Just Transition away from Coal in China,10.1016/j.oneear.2020.07.012,Coal  ，Carbon neutrality  ，Greenhouse gas emissions  ，Zero-emissions vehicle  ，Subsidy  ，Renewable energy  ，Efficient energy use  ，Wind power  ，Feed-in tariff  ，Steam-assisted gravity drainage  ，Low-carbon economy  ，Industrial policy  ，Infrastructure  ，Tax  ，Photovoltaics  ，Fossil fuel  ，Climate change  ，Politics of climate change  ，Athabasca oil sands  ，Solar power  ，Economic interventionism  ，Canada  ，Climate change mitigation  ，Petroleum  ，Carbon price  ，Energy development  ，Supply chain  ，Carbon capture and storage  ，Clean technology  ，Competition (economics)  ，Government spending  ，Tariff  ，Market (economics)  ，Natural gas  ，Manufacturing  ，Policy  ，Denmark  ，Economy  ，Market economy  ，Innovation  ，China  ，Economics  ，Fuel  ，Car  ，United States  ，Transport  ，Peter Lougheed  ，Green industrial policy  ，Energy industry  ，Oil sands  ，Electric vehicle  ，Green bond  ，Labour economics  ，Technology  ，Joe Biden  ，Green bank  ，Sustainability  ，Mariana Mazzucato  ，Carbon tax  ，Air pollution  ，Export  ，Procurement  ，Energy  ，Price  ，Agriculture  ，Nature  ，Interest  ，Public finance  ，Finance,https://www.policyalternatives.ca/publications/reports/bet-big,
Policy citation,worldbank-58ad182055c8fdd918a29bb10ad589b1,China Country Climate and Development Report,,World Bank,IGO,igo,,10/11/22,Enabling a Rapid and Just Transition away from Coal in China,10.1016/j.oneear.2020.07.012,Low-carbon economy  ，Climate change mitigation  ，Greenhouse gas emissions  ，Economic growth  ，Renewable energy  ，Climate change adaptation  ，Climate change  ，Efficient energy use  ，Emissions trading  ，Infrastructure  ，Carbon neutrality  ，Variable renewable energy  ，China  ，Wind power  ，Carbon offset  ，Solar power  ，Transport  ，Gross domestic product  ，Emission intensity  ，Innovation  ，Electrical grid  ，Electricity generation  ，Nature-based solutions  ，World Bank Group  ，Air pollution  ，Sustainable energy  ，Carbon price  ，Electrification  ，Coal-fired power station  ，Greenhouse gas  ，Agriculture  ，Cost of electricity by source  ，Labour economics  ，Natural environment  ，Economy  ，Nature  ，Energy  ，Carbon sequestration  ，Coal  ，Carbon capture and storage  ，Electricity market  ，Climate resilience  ，Subsidy  ，Economy of China  ，Market (economics)  ，Export  ，Energy development  ，City  ，Productivity  ，Public transport  ，Policy  ，Energiewende  ，Co-benefits of climate change mitigation  ，Rail transport  ，Finance  ，Tax  ，Poverty  ，Market economy  ，Employment  ，Water security  ，Non-tariff barriers to trade  ，Carbon tax  ，Politics of climate change  ，Environmental technology  ，Risk  ，Macroeconomics  ，World energy supply and consumption  ，Urban sprawl  ，Heavy industry  ，International Energy Agency,https://openknowledge.worldbank.org/handle/10986/38136,
